{
  "evidence_gate": {
    "checks": {
      "clock_mapping": {
        "domains": [
          "analysis_monotonic"
        ],
        "status": "PASS",
        "unmapped_sequences": []
      },
      "collection_bounds": {
        "status": "PASS"
      },
      "critical_window_coverage": {
        "gap_sequences": [],
        "status": "PASS"
      },
      "execution_environment": {
        "attestation_count": 1,
        "attestation_sequence": 1,
        "status": "PASS"
      },
      "hash_chain": {
        "errors": [],
        "status": "PASS"
      },
      "required_events": {
        "missing": [],
        "status": "PASS"
      },
      "route_identity": {
        "errors": [],
        "status": "PASS"
      },
      "run_identity": {
        "status": "PASS"
      }
    },
    "reasons": [],
    "status": "ADMISSIBLE"
  },
  "oracles": [
    {
      "clauses": {
        "continuity": {
          "evidence": {},
          "reasons": [
            "the preregistered target activation is expected to be rejected"
          ],
          "status": "NOT_APPLICABLE"
        },
        "exclusivity": {
          "evidence": {},
          "reasons": [
            "the preregistered target activation is expected to be rejected"
          ],
          "status": "NOT_APPLICABLE"
        },
        "installation": {
          "evidence": {},
          "reasons": [
            "the preregistered target activation is expected to be rejected"
          ],
          "status": "NOT_APPLICABLE"
        },
        "ownership": {
          "evidence": {},
          "reasons": [
            "the preregistered target activation is expected to be rejected"
          ],
          "status": "NOT_APPLICABLE"
        },
        "reentry_identity": {
          "evidence": {},
          "reasons": [
            "the preregistered target activation is expected to be rejected"
          ],
          "status": "NOT_APPLICABLE"
        },
        "revocation": {
          "evidence": {},
          "reasons": [
            "the preregistered target activation is expected to be rejected"
          ],
          "status": "NOT_APPLICABLE"
        }
      },
      "oracle": "route_conformance"
    },
    {
      "clauses": {
        "freshness": {
          "evidence": {},
          "reasons": [
            "the preregistered target activation is expected to be rejected"
          ],
          "status": "NOT_APPLICABLE"
        },
        "lineage": {
          "evidence": {},
          "reasons": [
            "the preregistered target activation is expected to be rejected"
          ],
          "status": "NOT_APPLICABLE"
        }
      },
      "oracle": "freshness_lineage"
    },
    {
      "clauses": {
        "adjacent_order": {
          "evidence": {},
          "reasons": [
            "no adjacent request is planned"
          ],
          "status": "NOT_APPLICABLE"
        },
        "adjacent_successor": {
          "evidence": {},
          "reasons": [
            "no adjacent request is planned"
          ],
          "status": "NOT_APPLICABLE"
        },
        "adjacent_timing": {
          "evidence": {},
          "reasons": [
            "no adjacent request is planned"
          ],
          "status": "NOT_APPLICABLE"
        },
        "expected_successor": {
          "evidence": {},
          "reasons": [
            "completion is not part of this plan"
          ],
          "status": "NOT_APPLICABLE"
        },
        "fault_observation": {
          "evidence": {
            "fault_sequence": 398
          },
          "reasons": [],
          "status": "PASS"
        },
        "safe_fallback": {
          "evidence": {},
          "reasons": [
            "fault is not part of this plan"
          ],
          "status": "NOT_APPLICABLE"
        }
      },
      "oracle": "successor_progression"
    },
    {
      "clauses": {
        "activation_rejection": {
          "evidence": {
            "rejection_sequences": [
              398
            ]
          },
          "reasons": [],
          "status": "PASS"
        },
        "registration_rejection": {
          "evidence": {},
          "reasons": [
            "registration rejection is not expected"
          ],
          "status": "NOT_APPLICABLE"
        }
      },
      "oracle": "registration_contract"
    }
  ],
  "plan_id": "fault-dynamic-health-loss-003-plan",
  "run_id": "fault-dynamic-health-loss-003",
  "schema_version": "1.0",
  "status": "PASS"
}
