{
  "evidence_gate": {
    "checks": {
      "clock_mapping": {
        "domains": [
          "analysis_monotonic"
        ],
        "status": "PASS",
        "unmapped_sequences": []
      },
      "collection_bounds": {
        "status": "PASS"
      },
      "critical_window_coverage": {
        "gap_sequences": [],
        "status": "PASS"
      },
      "execution_environment": {
        "attestation_count": 1,
        "attestation_sequence": 1,
        "status": "PASS"
      },
      "hash_chain": {
        "errors": [],
        "status": "PASS"
      },
      "required_events": {
        "missing": [],
        "status": "PASS"
      },
      "route_identity": {
        "errors": [],
        "status": "PASS"
      },
      "run_identity": {
        "status": "PASS"
      }
    },
    "reasons": [],
    "status": "ADMISSIBLE"
  },
  "oracles": [
    {
      "clauses": {
        "continuity": {
          "evidence": {
            "effect_gap_ns": 99984470,
            "maximum_effect_gap_ns": 250000000
          },
          "reasons": [],
          "status": "PASS"
        },
        "exclusivity": {
          "evidence": {
            "target_write_ns": 1316426454120244
          },
          "reasons": [],
          "status": "PASS"
        },
        "installation": {
          "evidence": {
            "complete": true,
            "completed_at_ns": 1316426454120244,
            "events": {
              "activation": {
                "sequence": 403,
                "timestamp_ns": 1316426402128320
              },
              "actuator_write": {
                "sequence": 408,
                "timestamp_ns": 1316426454120244
              },
              "allocator_output": {
                "sequence": 407,
                "timestamp_ns": 1316426454120244
              },
              "command_consumed": {
                "sequence": 405,
                "timestamp_ns": 1316426442122108
              },
              "controller_output": {
                "sequence": 406,
                "timestamp_ns": 1316426454120244
              }
            },
            "identity": {
              "activation_id": "nav-23-epoch-4",
              "allocator_id": "px4-control-allocator",
              "controller_id": "mc_position_control",
              "executor_owner": "none",
              "lifecycle_owner": "family_a_external_mode",
              "producer_session": "family_a_external_mode",
              "registration_id": "external-nav-23",
              "route": "dynamic_external_mode",
              "route_epoch": "px4-epoch-4",
              "writer_id": "px4-control-allocator-actuator-motors"
            }
          },
          "reasons": [],
          "status": "PASS"
        },
        "ownership": {
          "evidence": {
            "expected_executor_owner": "none",
            "expected_lifecycle_owner": "family_a_external_mode",
            "observed_executor_owner": "none",
            "observed_lifecycle_owner": "family_a_external_mode"
          },
          "reasons": [],
          "status": "PASS"
        },
        "reentry_identity": {
          "evidence": {},
          "reasons": [
            "no repeated-entry identity obligation was preregistered"
          ],
          "status": "NOT_APPLICABLE"
        },
        "revocation": {
          "evidence": {
            "last_source_effect_ns": 1316426354135774,
            "revocation_sequence": 402
          },
          "reasons": [],
          "status": "PASS"
        }
      },
      "oracle": "route_conformance",
      "transition_sequence": 401
    },
    {
      "clauses": {
        "freshness": {
          "evidence": {
            "authority_window_end_ns": 1316434597864016,
            "checked_events": 325,
            "maximum_observed_age_ns": 104018337
          },
          "reasons": [],
          "status": "PASS"
        },
        "lineage": {
          "evidence": {
            "installed_identity": {
              "activation_id": "nav-23-epoch-4",
              "allocator_id": "px4-control-allocator",
              "controller_id": "mc_position_control",
              "executor_owner": "none",
              "lifecycle_owner": "family_a_external_mode",
              "producer_session": "family_a_external_mode",
              "registration_id": "external-nav-23",
              "route": "dynamic_external_mode",
              "route_epoch": "px4-epoch-4",
              "writer_id": "px4-control-allocator-actuator-motors"
            }
          },
          "reasons": [],
          "status": "PASS"
        }
      },
      "oracle": "freshness_lineage"
    },
    {
      "clauses": {
        "adjacent_order": {
          "evidence": {},
          "reasons": [
            "no adjacent request is planned"
          ],
          "status": "NOT_APPLICABLE"
        },
        "adjacent_successor": {
          "evidence": {},
          "reasons": [
            "no adjacent request is planned"
          ],
          "status": "NOT_APPLICABLE"
        },
        "adjacent_timing": {
          "evidence": {},
          "reasons": [
            "no adjacent request is planned"
          ],
          "status": "NOT_APPLICABLE"
        },
        "expected_successor": {
          "evidence": {
            "complete": true,
            "completed_at_ns": 1316434753843877,
            "events": {
              "activation": {
                "sequence": 734,
                "timestamp_ns": 1316434597864016
              },
              "actuator_write": {
                "sequence": 739,
                "timestamp_ns": 1316434753843877
              },
              "allocator_output": {
                "sequence": 738,
                "timestamp_ns": 1316434753843877
              },
              "command_consumed": {
                "sequence": 736,
                "timestamp_ns": 1316434657848592
              },
              "controller_output": {
                "sequence": 737,
                "timestamp_ns": 1316434753843877
              }
            },
            "identity": {
              "activation_id": "nav-5-epoch-5",
              "allocator_id": "px4-control-allocator",
              "controller_id": "mc_position_control",
              "executor_owner": "none",
              "lifecycle_owner": "px4_commander",
              "producer_session": "px4-internal",
              "registration_id": "px4-built-in",
              "route": "internal_rtl",
              "route_epoch": "px4-epoch-5",
              "writer_id": "px4-control-allocator-actuator-motors"
            }
          },
          "reasons": [],
          "status": "PASS"
        },
        "fault_observation": {
          "evidence": {},
          "reasons": [
            "fault is not part of this plan"
          ],
          "status": "NOT_APPLICABLE"
        },
        "safe_fallback": {
          "evidence": {},
          "reasons": [
            "fault is not part of this plan"
          ],
          "status": "NOT_APPLICABLE"
        }
      },
      "oracle": "successor_progression"
    },
    {
      "clauses": {
        "activation_rejection": {
          "evidence": {},
          "reasons": [
            "activation rejection is not expected"
          ],
          "status": "NOT_APPLICABLE"
        },
        "registration_rejection": {
          "evidence": {},
          "reasons": [
            "registration rejection is not expected"
          ],
          "status": "NOT_APPLICABLE"
        }
      },
      "oracle": "registration_contract"
    }
  ],
  "plan_id": "det-dynamic-trajectory-rtl-003-plan",
  "run_id": "det-dynamic-trajectory-rtl-003",
  "schema_version": "1.0",
  "status": "PASS"
}
